{
  "schemaVersion": "1.1.0",
  "kind": "holocity.scene-export",
  "sceneName": "Synthetic HoloCity",
  "unityScenePath": "Assets/Scenes/Synthetic.unity",
  "exportedAt": "2026-08-02T12:00:00.000Z",
  "exportMode": "whole",
  "baseHash": "48711fe9cfc21b99247377e364a04072de86da713a95c61b48bed3215f7a1210",
  "entries": [
    {
      "id": "GlobalObjectId_V1-edit-0",
      "name": "Asymmetric L",
      "prefabPath": "Assets/HoloCity/BlockA.prefab",
      "kitFamily": "Civic",
      "editable": true,
      "transform": {
        "position": [
          -10,
          0,
          -8
        ],
        "rotation": [
          0,
          0,
          0,
          1
        ],
        "scale": [
          1,
          1,
          1
        ]
      },
      "state": {
        "active": true,
        "layer": "Buildings",
        "tag": "Untagged",
        "staticFlags": [
          "BatchingStatic"
        ],
        "materialVariant": null
      },
      "glb": "meshes/l-shape.glb",
      "boundsSize": [
        2,
        1,
        2
      ]
    },
    {
      "id": "GlobalObjectId_V1-edit-1",
      "name": "Town prop 2",
      "prefabPath": "Assets/HoloCity/BlockB.prefab",
      "kitFamily": "Market",
      "editable": true,
      "transform": {
        "position": [
          -6,
          0,
          -8
        ],
        "rotation": [
          0,
          0,
          0,
          1
        ],
        "scale": [
          1,
          1,
          1
        ]
      },
      "state": {
        "active": true,
        "layer": "Default",
        "tag": "Untagged",
        "staticFlags": [],
        "materialVariant": null
      },
      "glb": "meshes/block.glb",
      "boundsSize": [
        2,
        1,
        2
      ]
    },
    {
      "id": "GlobalObjectId_V1-edit-2",
      "name": "Town prop 3",
      "prefabPath": "Assets/HoloCity/Tower.prefab",
      "kitFamily": "Civic",
      "editable": true,
      "transform": {
        "position": [
          -2,
          0,
          -8
        ],
        "rotation": [
          0,
          0,
          0,
          1
        ],
        "scale": [
          1,
          1,
          1
        ]
      },
      "state": {
        "active": true,
        "layer": "Buildings",
        "tag": "Untagged",
        "staticFlags": [],
        "materialVariant": null
      },
      "glb": "meshes/block.glb",
      "boundsSize": [
        2,
        1,
        2
      ]
    },
    {
      "id": "GlobalObjectId_V1-edit-3",
      "name": "Town prop 4",
      "prefabPath": "Assets/HoloCity/LShape.prefab",
      "kitFamily": "Test",
      "editable": true,
      "transform": {
        "position": [
          2,
          0,
          -8
        ],
        "rotation": [
          0,
          0,
          0,
          1
        ],
        "scale": [
          1,
          1,
          1
        ]
      },
      "state": {
        "active": true,
        "layer": "Default",
        "tag": "Untagged",
        "staticFlags": [],
        "materialVariant": null
      },
      "glb": "meshes/block.glb",
      "boundsSize": [
        2,
        1,
        2
      ]
    },
    {
      "id": "GlobalObjectId_V1-edit-4",
      "name": "Town prop 5",
      "prefabPath": "Assets/HoloCity/BlockA.prefab",
      "kitFamily": "Civic",
      "editable": true,
      "transform": {
        "position": [
          6,
          0,
          -8
        ],
        "rotation": [
          0,
          0,
          0,
          1
        ],
        "scale": [
          1,
          1,
          1
        ]
      },
      "state": {
        "active": true,
        "layer": "Buildings",
        "tag": "Untagged",
        "staticFlags": [],
        "materialVariant": null
      },
      "glb": "meshes/block.glb",
      "boundsSize": [
        2,
        1,
        2
      ]
    },
    {
      "id": "GlobalObjectId_V1-edit-5",
      "name": "Town prop 6",
      "prefabPath": "Assets/HoloCity/BlockB.prefab",
      "kitFamily": "Market",
      "editable": true,
      "transform": {
        "position": [
          10,
          0,
          -8
        ],
        "rotation": [
          0,
          0,
          0,
          1
        ],
        "scale": [
          1,
          1,
          1
        ]
      },
      "state": {
        "active": true,
        "layer": "Default",
        "tag": "Untagged",
        "staticFlags": [
          "BatchingStatic"
        ],
        "materialVariant": null
      },
      "glb": "meshes/block.glb",
      "boundsSize": [
        2,
        1,
        2
      ]
    },
    {
      "id": "GlobalObjectId_V1-edit-6",
      "name": "Town prop 7",
      "prefabPath": "Assets/HoloCity/Tower.prefab",
      "kitFamily": "Civic",
      "editable": true,
      "transform": {
        "position": [
          -10,
          0,
          -4
        ],
        "rotation": [
          0,
          0,
          0,
          1
        ],
        "scale": [
          1,
          1,
          1
        ]
      },
      "state": {
        "active": true,
        "layer": "Buildings",
        "tag": "Untagged",
        "staticFlags": [],
        "materialVariant": null
      },
      "glb": "meshes/block.glb",
      "boundsSize": [
        2,
        1,
        2
      ]
    },
    {
      "id": "GlobalObjectId_V1-edit-7",
      "name": "Town prop 8",
      "prefabPath": "Assets/HoloCity/LShape.prefab",
      "kitFamily": "Test",
      "editable": true,
      "transform": {
        "position": [
          -6,
          0,
          -4
        ],
        "rotation": [
          0,
          0,
          0,
          1
        ],
        "scale": [
          1,
          1,
          1
        ]
      },
      "state": {
        "active": true,
        "layer": "Default",
        "tag": "Untagged",
        "staticFlags": [],
        "materialVariant": null
      },
      "glb": "meshes/block.glb",
      "boundsSize": [
        2,
        1,
        2
      ]
    },
    {
      "id": "GlobalObjectId_V1-edit-8",
      "name": "Town prop 9",
      "prefabPath": "Assets/HoloCity/BlockA.prefab",
      "kitFamily": "Civic",
      "editable": true,
      "transform": {
        "position": [
          -2,
          0,
          -4
        ],
        "rotation": [
          0,
          0,
          0,
          1
        ],
        "scale": [
          1,
          1,
          1
        ]
      },
      "state": {
        "active": true,
        "layer": "Buildings",
        "tag": "Untagged",
        "staticFlags": [],
        "materialVariant": null
      },
      "glb": "meshes/block.glb",
      "boundsSize": [
        2,
        1,
        2
      ]
    },
    {
      "id": "GlobalObjectId_V1-edit-9",
      "name": "Town prop 10",
      "prefabPath": "Assets/HoloCity/BlockB.prefab",
      "kitFamily": "Market",
      "editable": true,
      "transform": {
        "position": [
          2,
          0,
          -4
        ],
        "rotation": [
          0,
          0,
          0,
          1
        ],
        "scale": [
          1,
          1,
          1
        ]
      },
      "state": {
        "active": true,
        "layer": "Default",
        "tag": "Untagged",
        "staticFlags": [],
        "materialVariant": null
      },
      "glb": "meshes/block.glb",
      "boundsSize": [
        2,
        1,
        2
      ]
    },
    {
      "id": "GlobalObjectId_V1-edit-10",
      "name": "Town prop 11",
      "prefabPath": "Assets/HoloCity/Tower.prefab",
      "kitFamily": "Civic",
      "editable": true,
      "parentId": "GlobalObjectId_V1-locked-0",
      "transform": {
        "position": [
          6,
          0,
          -4
        ],
        "rotation": [
          0,
          0,
          0,
          1
        ],
        "scale": [
          1,
          1,
          1
        ]
      },
      "state": {
        "active": true,
        "layer": "Buildings",
        "tag": "Untagged",
        "staticFlags": [
          "BatchingStatic"
        ],
        "materialVariant": null
      },
      "glb": "meshes/block.glb",
      "boundsSize": [
        2,
        1,
        2
      ]
    },
    {
      "id": "GlobalObjectId_V1-edit-11",
      "name": "Town prop 12",
      "prefabPath": "Assets/HoloCity/LShape.prefab",
      "kitFamily": "Test",
      "editable": true,
      "parentId": "GlobalObjectId_V1-locked-0",
      "transform": {
        "position": [
          10,
          0,
          -4
        ],
        "rotation": [
          0,
          0,
          0,
          1
        ],
        "scale": [
          1,
          1,
          1
        ]
      },
      "state": {
        "active": true,
        "layer": "Default",
        "tag": "Untagged",
        "staticFlags": [],
        "materialVariant": null
      },
      "glb": "meshes/block.glb",
      "boundsSize": [
        2,
        1,
        2
      ]
    },
    {
      "id": "GlobalObjectId_V1-edit-12",
      "name": "Town prop 13",
      "prefabPath": "Assets/HoloCity/BlockA.prefab",
      "kitFamily": "Civic",
      "editable": true,
      "parentId": "GlobalObjectId_V1-locked-0",
      "transform": {
        "position": [
          -10,
          0,
          0
        ],
        "rotation": [
          0,
          0,
          0,
          1
        ],
        "scale": [
          1,
          1,
          1
        ]
      },
      "state": {
        "active": true,
        "layer": "Buildings",
        "tag": "Untagged",
        "staticFlags": [],
        "materialVariant": null
      },
      "glb": "meshes/block.glb",
      "boundsSize": [
        2,
        1,
        2
      ]
    },
    {
      "id": "GlobalObjectId_V1-edit-13",
      "name": "Town prop 14",
      "prefabPath": "Assets/HoloCity/BlockB.prefab",
      "kitFamily": "Market",
      "editable": true,
      "parentId": "GlobalObjectId_V1-locked-0",
      "transform": {
        "position": [
          -6,
          0,